{
  "schemaVersion": "sacs-v05-progressive-status/1.0",
  "source": {
    "repository": "zhouwen-giser/single-agent-chat-server",
    "branch": "codex/sacs-v0.5-observer-first-interactive-analysis",
    "headSha": "4b42849ed03fbd0891fd12845955946731efcb6e"
  },
  "development": "FEATURE_COMPLETE",
  "integration": "INTEGRATION_PENDING",
  "release": "RELEASE_HARDENING_PENDING",
  "pendingReasons": [
    "AUTHORITATIVE_WSGS_ANALYSIS_CONTROL_HANDOFF_UNAVAILABLE",
    "RELEASE_QUALIFICATION_NOT_REQUESTED"
  ],
  "hardFailures": [],
  "updatedAt": "2026-09-05T05:31:35.556Z"
}
